{
  "schemaVersion": "1.0.0",
  "checkedAt": "2026-07-03",
  "policy": {
    "maxAgeDays": 30,
    "acceptedStatusCodes": [
      401,
      403,
      405,
      429
    ]
  },
  "links": [
    {
      "url": "https://adibirzu.github.io/obs/",
      "sources": [
        "README.md",
        "deploy/portal-ingress.yaml"
      ],
      "statusCode": 200,
      "lastChecked": "2026-07-03"
    },
    {
      "url": "https://app.diagrams.net/",
      "sources": [
        "interlocks.html",
        "scripts/generate-interlocks-pdf.mjs"
      ],
      "statusCode": 200,
      "lastChecked": "2026-07-03"
    },
    {
      "url": "https://blogs.oracle.com/cloud-infrastructure/post/get-insight-into-api-gateway-logs-using-oci-logging-analytics",
      "sources": [
        "launchpad.html"
      ],
      "statusCode": 200,
      "redirectedTo": "https://blogs.oracle.com/observability/api-observability-log-analytics",
      "lastChecked": "2026-07-03"
    },
    {
      "url": "https://blogs.oracle.com/integration/oci-logging-analytics-dashboards-for-oracle-integration-oic",
      "sources": [
        "launchpad.html"
      ],
      "statusCode": 200,
      "lastChecked": "2026-07-03"
    },
    {
      "url": "https://blogs.oracle.com/observability/",
      "sources": [
        "README.md",
        "assets/resources.js",
        "launchpad.html"
      ],
      "statusCode": 200,
      "lastChecked": "2026-07-03"
    },
    {
      "url": "https://blogs.oracle.com/observability/level-up-your-skills-oci-2025-observability-professional-certification-is-here",
      "sources": [
        "launchpad.html"
      ],
      "statusCode": 200,
      "lastChecked": "2026-07-03"
    },
    {
      "url": "https://blogs.oracle.com/observability/post/connect-apm-with-log-analytics-and-more",
      "sources": [
        "assets/resources.js"
      ],
      "statusCode": 200,
      "redirectedTo": "https://blogs.oracle.com/observability/connect-apm-with-log-analytics-and-more",
      "lastChecked": "2026-07-03"
    },
    {
      "url": "https://blogs.oracle.com/observability/post/monitoring-oci-waf--la",
      "sources": [
        "launchpad.html"
      ],
      "statusCode": 200,
      "redirectedTo": "https://blogs.oracle.com/observability/monitoring-oci-waf--la",
      "lastChecked": "2026-07-03"
    },
    {
      "url": "https://blogs.oracle.com/observability/post/oracle-cloud-infrastructure-security-fundamentals-dashboards-using-oci-logging-analytics",
      "sources": [
        "launchpad.html"
      ],
      "statusCode": 200,
      "redirectedTo": "https://blogs.oracle.com/observability/oracle-cloud-infrastructure-security-fundamentals-dashboards-using-oci-logging-analytics",
      "lastChecked": "2026-07-03"
    },
    {
      "url": "https://convert.diagrams.net/node/export",
      "sources": [
        "scripts/generate-interlocks-pdf.mjs"
      ],
      "statusCode": 200,
      "lastChecked": "2026-07-03"
    },
    {
      "url": "https://docs.oracle.com/en-us/iaas/application-performance-monitoring/doc/application-performance-monitoring-data-sources.html",
      "sources": [
        "launchpad.html"
      ],
      "statusCode": 200,
      "lastChecked": "2026-07-03"
    },
    {
      "url": "https://docs.oracle.com/en-us/iaas/application-performance-monitoring/doc/application-performance-monitoring.html",
      "sources": [
        "assets/interlocks/catalog-data.js",
        "assets/interlocks/catalog.json",
        "assets/interlocks/documentation-sources.json",
        "interlocks.html",
        "launchpad.html"
      ],
      "statusCode": 200,
      "lastChecked": "2026-07-03"
    },
    {
      "url": "https://docs.oracle.com/en-us/iaas/application-performance-monitoring/doc/configure-attributes-real-user-monitoring.html",
      "sources": [
        "launchpad.html"
      ],
      "statusCode": 200,
      "lastChecked": "2026-07-03"
    },
    {
      "url": "https://docs.oracle.com/en-us/iaas/application-performance-monitoring/doc/configure-browser-agent-real-user-monitoring.html",
      "sources": [
        "launchpad.html"
      ],
      "statusCode": 200,
      "lastChecked": "2026-07-03"
    },
    {
      "url": "https://docs.oracle.com/en-us/iaas/application-performance-monitoring/doc/use-synthetic-monitoring.html",
      "sources": [
        "launchpad.html"
      ],
      "statusCode": 200,
      "lastChecked": "2026-07-03"
    },
    {
      "url": "https://docs.oracle.com/en-us/iaas/application-performance-monitoring/home.htm",
      "sources": [
        "assets/scenarios/retail-checkout-multicloud.json",
        "docs/observability-design-guide.md",
        "docs/scenarios/retail-checkout-multicloud.md",
        "index.html"
      ],
      "statusCode": 200,
      "lastChecked": "2026-07-03"
    },
    {
      "url": "https://docs.oracle.com/en-us/iaas/application-performance-monitoring/index.html",
      "sources": [
        "launchpad.html"
      ],
      "statusCode": 200,
      "redirectedTo": "https://docs.oracle.com/en-us/iaas/application-performance-monitoring/home.htm",
      "lastChecked": "2026-07-03"
    },
    {
      "url": "https://docs.oracle.com/en-us/iaas/cloud-guard/home.htm",
      "sources": [
        "assets/interlocks/catalog-data.js",
        "assets/interlocks/catalog.json",
        "assets/interlocks/documentation-sources.json",
        "launchpad.html"
      ],
      "statusCode": 200,
      "redirectedTo": "https://docs.oracle.com/en-us/iaas/Content/cloud-guard/home.htm",
      "lastChecked": "2026-07-03"
    },
    {
      "url": "https://docs.oracle.com/en-us/iaas/cloud-guard/using/cgis.htm",
      "sources": [
        "assets/guide.js"
      ],
      "statusCode": 200,
      "redirectedTo": "https://docs.oracle.com/en-us/iaas/Content/cloud-guard/using/cgis.htm",
      "lastChecked": "2026-07-03"
    },
    {
      "url": "https://docs.oracle.com/en-us/iaas/Content/APIGateway/home.htm",
      "sources": [
        "launchpad.html"
      ],
      "statusCode": 200,
      "lastChecked": "2026-07-03"
    },
    {
      "url": "https://docs.oracle.com/en-us/iaas/Content/Audit/home.htm",
      "sources": [
        "assets/guide.js",
        "docs/observability-design-guide.md"
      ],
      "statusCode": 200,
      "lastChecked": "2026-07-03"
    },
    {
      "url": "https://docs.oracle.com/en-us/iaas/Content/Balance/Concepts/balanceoverview.htm",
      "sources": [
        "assets/interlocks/catalog-data.js",
        "assets/interlocks/catalog.json",
        "assets/interlocks/documentation-sources.json"
      ],
      "statusCode": 200,
      "lastChecked": "2026-07-03"
    },
    {
      "url": "https://docs.oracle.com/en-us/iaas/Content/Billing/Concepts/budgetsoverview.htm",
      "sources": [
        "assets/interlocks/documentation-sources.json",
        "scripts/generate-interlocks-drawio.mjs"
      ],
      "statusCode": 200,
      "lastChecked": "2026-07-03"
    },
    {
      "url": "https://docs.oracle.com/en-us/iaas/Content/Billing/Concepts/costanalysisoverview.htm",
      "sources": [
        "assets/interlocks/catalog-data.js",
        "assets/interlocks/catalog.json",
        "assets/interlocks/documentation-sources.json"
      ],
      "statusCode": 200,
      "lastChecked": "2026-07-03"
    },
    {
      "url": "https://docs.oracle.com/en-us/iaas/Content/Billing/Concepts/costmanagementoverview.htm",
      "sources": [
        "launchpad.html"
      ],
      "statusCode": 200,
      "lastChecked": "2026-07-03"
    },
    {
      "url": "https://docs.oracle.com/en-us/iaas/Content/certificates/home.htm",
      "sources": [
        "assets/interlocks/catalog-data.js",
        "assets/interlocks/catalog.json",
        "assets/interlocks/documentation-sources.json"
      ],
      "statusCode": 200,
      "lastChecked": "2026-07-03"
    },
    {
      "url": "https://docs.oracle.com/en-us/iaas/Content/cloud-adoption-framework/monitoring-and-observability.htm",
      "sources": [
        "launchpad.html",
        "static/observability.js"
      ],
      "statusCode": 200,
      "lastChecked": "2026-07-03"
    },
    {
      "url": "https://docs.oracle.com/en-us/iaas/Content/cloud-adoption-framework/oci-landing-zones-overview.htm",
      "sources": [
        "assets/interlocks/catalog-data.js",
        "assets/interlocks/catalog.json",
        "assets/interlocks/documentation-sources.json",
        "scripts/generate-interlocks-drawio.mjs"
      ],
      "statusCode": 200,
      "lastChecked": "2026-07-03"
    },
    {
      "url": "https://docs.oracle.com/en-us/iaas/Content/CloudAdvisor/Concepts/cloudadvisoroverview.htm",
      "sources": [
        "assets/interlocks/catalog-data.js",
        "assets/interlocks/catalog.json",
        "assets/interlocks/documentation-sources.json"
      ],
      "statusCode": 200,
      "lastChecked": "2026-07-03"
    },
    {
      "url": "https://docs.oracle.com/en-us/iaas/Content/connector-hub/home.htm",
      "sources": [
        "assets/guide.js",
        "assets/interlocks/catalog-data.js",
        "assets/interlocks/catalog.json",
        "assets/interlocks/documentation-sources.json",
        "docs/observability-design-guide.md"
      ],
      "statusCode": 200,
      "lastChecked": "2026-07-03"
    },
    {
      "url": "https://docs.oracle.com/en-us/iaas/Content/connector-hub/overview.htm",
      "sources": [
        "assets/interlocks/documentation-sources.json",
        "scripts/generate-interlocks-drawio.mjs"
      ],
      "statusCode": 200,
      "lastChecked": "2026-07-03"
    },
    {
      "url": "https://docs.oracle.com/en-us/iaas/Content/ContEng/Tasks/contengmonitoringclusters.htm",
      "sources": [
        "launchpad.html"
      ],
      "statusCode": 200,
      "lastChecked": "2026-07-03"
    },
    {
      "url": "https://docs.oracle.com/en-us/iaas/Content/devops/using/home.htm",
      "sources": [
        "assets/guide.js"
      ],
      "statusCode": 200,
      "lastChecked": "2026-07-03"
    },
    {